{
  "name": "similarweb",
  "displayName": "Similarweb",
  "description": "Analyze website traffic, audiences, and competitors.",
  "homepage": "https://docs.similarweb.com/api-v5/similarweb-mcp",
  "docs": "https://github.com/cursor/plugins/tree/c1c0a32802223f4be824112dd83d33ad29a8b26c/third_party/similarweb",
  "logo": "logo.png",
  "auth": "oauth",
  "mcpServers": {
    "similarweb": {
      "url": "https://mcp.similarweb.com"
    }
  }
}
