{
  "name": "ashby",
  "displayName": "Ashby",
  "description": "Search candidates, prep interviews, and manage pipeline tasks.",
  "homepage": "https://docs.ashbyhq.com/ashby-mcp-server-beta",
  "docs": "https://github.com/cursor/plugins/tree/c1c0a32802223f4be824112dd83d33ad29a8b26c/third_party/ashby",
  "logo": "logo.png",
  "auth": "oauth",
  "mcpServers": {
    "ashby": {
      "url": "https://mcp.ashbyhq.com/mcp/v1"
    }
  }
}
