{
  "name": "microsoft-365-files",
  "displayName": "Microsoft 365 OneDrive & SharePoint",
  "description": "OneDrive and SharePoint: browse, read, upload and delete Microsoft 365 files and sites.",
  "homepage": "https://www.microsoft.com/microsoft-365",
  "docs": "https://github.com/CognitionAI/devin-marketplace/tree/8ba5035403fdb5ae4ca6b45243cc6a04415d0aac/plugins/microsoft-365-files",
  "logo": "logo.svg",
  "auth": "oauth",
  "mcpServers": {
    "microsoft-365-files": {
      "url": "https://microsoft-365-mcp.devin.ai/files/mcp"
    }
  }
}
