{
  "name": "mailerlite",
  "displayName": "MailerLite",
  "description": "Manage subscribers, groups, campaigns, and automations.",
  "homepage": "https://developers.mailerlite.com/mcp",
  "docs": "https://github.com/cursor/plugins/tree/c1c0a32802223f4be824112dd83d33ad29a8b26c/third_party/mailerlite",
  "logo": "logo.png",
  "auth": "oauth",
  "mcpServers": {
    "mailerlite": {
      "url": "https://mcp.mailerlite.com/mcp"
    }
  }
}
